{
  "schemaVersion": 1,
  "type": "challenge",
  "id": "example.challenge-showcase:challenge/lamarr-remix",
  "displayName": "Lamarr Remix",
  "description": "Complete Lamarr's original objective to unlock this alternate reward.",
  "extends": "core:challenge/lamarr",
  "rewards": ["core:clothing/hair-2"]
}
